{
  "version": "1.0.0",
  "total_disciplines": 55,
  "clusters": [
    "AI & Intelligent Systems",
    "Robotics, Physical Systems & Autonomous Vehicles",
    "Frontier Physics, Quantum & Clean Energy",
    "Earth Sciences, Materials & Engineering",
    "Industrial Systems, SCADA & Utilities",
    "Cybersecurity, Cryptography & Digital Forensics",
    "Systems Programming, Cloud & Distributed Engines",
    "Web, Mobile, Desktop & Creative Applications"
  ],
  "disciplines": [
    {
      "id": 1,
      "stable_id": "cat-01-curated-knowledge",
      "name": "Curated Knowledge, Developer Guides, Books & Awesome Collections",
      "slug": "curated-knowledge-developer-guides-books-awesome-collections",
      "description": "Curated knowledge aggregation, community-driven awesome lists, canonical developer roadmaps, interactive CS curricula, free programming books, and public API registries that synthesize technical literature and learning pathways.",
      "parent_cluster": "AI & Intelligent Systems",
      "keywords": [
        "awesome-list",
        "developer-roadmap",
        "computer-science-curriculum",
        "free-programming-books",
        "public-apis",
        "cheat-sheets",
        "study-plan",
        "interview-prep",
        "system-design-primer"
      ],
      "top_languages": [
        "Other",
        "Python",
        "JavaScript",
        "Shell",
        "HTML"
      ],
      "metrics": {
        "repository_count": 689,
        "total_stars": 16178214,
        "total_forks": 2335673,
        "language_diversity": 38
      }
    },
    {
      "id": 2,
      "stable_id": "cat-02-ai-foundation-models",
      "name": "Artificial Intelligence, Large Language Models, Foundation Models & Quantization",
      "slug": "artificial-intelligence-large-language-models-foundation-models-quantization",
      "description": "Pre-trained foundation models, Large Language Models (LLMs), Transformer architectures, efficient model serving engines, quantization techniques (GGUF, AWQ, GPTQ), and parameter-efficient fine-tuning (LoRA, QLoRA).",
      "parent_cluster": "AI & Intelligent Systems",
      "keywords": [
        "llm",
        "transformers",
        "foundation-models",
        "quantization",
        "gguf",
        "vllm",
        "ollama",
        "fine-tuning",
        "lora",
        "llama"
      ],
      "top_languages": [
        "Python",
        "TypeScript",
        "Jupyter Notebook",
        "Other",
        "JavaScript"
      ],
      "metrics": {
        "repository_count": 1101,
        "total_stars": 22083549,
        "total_forks": 3490395,
        "language_diversity": 28
      }
    },
    {
      "id": 3,
      "stable_id": "cat-03-multi-agent-systems",
      "name": "Multi-Agent Systems, Autonomous Swarms, AI Orchestration & MCP Tools",
      "slug": "multi-agent-systems-autonomous-swarms-ai-orchestration-mcp-tools",
      "description": "Autonomous multi-agent coordination frameworks, cognitive architectures, swarm intelligence, Model Context Protocol (MCP) tool integrations, planning engines, execution DAGs, and autonomous developer agents.",
      "parent_cluster": "AI & Intelligent Systems",
      "keywords": [
        "multi-agent",
        "autonomous-agents",
        "mcp",
        "langchain",
        "crewai",
        "autogpt",
        "swarm-intelligence",
        "orchestration",
        "agent-framework"
      ],
      "top_languages": [
        "Python",
        "TypeScript",
        "Rust",
        "Go",
        "JavaScript"
      ],
      "metrics": {
        "repository_count": 303,
        "total_stars": 7471295,
        "total_forks": 937271,
        "language_diversity": 17
      }
    },
    {
      "id": 4,
      "stable_id": "cat-04-computer-vision-multimodal",
      "name": "Computer Vision, Multimodal AI, Diffusion & Neural Rendering (NeRF/3D-GS)",
      "slug": "computer-vision-multimodal-ai-diffusion-neural-rendering-nerf-3d-gs",
      "description": "Visual perception, image segmentation, object detection, multimodal vision-language models (VLM), generative latent diffusion pipelines, and 3D neural rendering including Neural Radiance Fields (NeRF) and 3D Gaussian Splatting (3D-GS).",
      "parent_cluster": "AI & Intelligent Systems",
      "keywords": [
        "computer-vision",
        "diffusion-models",
        "stable-diffusion",
        "comfyui",
        "nerf",
        "gaussian-splatting",
        "yolo",
        "segmentation",
        "multimodal"
      ],
      "top_languages": [
        "Python",
        "C++",
        "Jupyter Notebook",
        "TypeScript",
        "JavaScript"
      ],
      "metrics": {
        "repository_count": 84,
        "total_stars": 1108140,
        "total_forks": 215209,
        "language_diversity": 15
      }
    },
    {
      "id": 5,
      "stable_id": "cat-05-speech-voice-audio",
      "name": "Speech, Voice AI, Audio Processing, Audio Synthesis & Music Generation",
      "slug": "speech-voice-ai-audio-processing-audio-synthesis-music-generation",
      "description": "Automatic Speech Recognition (ASR), Text-to-Speech (TTS), neural voice cloning, acoustic feature extraction, real-time voice conversion, and deep generative audio/music synthesis.",
      "parent_cluster": "AI & Intelligent Systems",
      "keywords": [
        "speech-recognition",
        "tts",
        "whisper",
        "voice-cloning",
        "audio-synthesis",
        "music-generation",
        "vocoder",
        "audio-dsp",
        "speech-to-text"
      ],
      "top_languages": [
        "Python",
        "TypeScript",
        "C++",
        "Swift",
        "Jupyter Notebook"
      ],
      "metrics": {
        "repository_count": 46,
        "total_stars": 698744,
        "total_forks": 80076,
        "language_diversity": 8
      }
    },
    {
      "id": 6,
      "stable_id": "cat-06-robotics-kinematics",
      "name": "Robotics, Humanoid Kinematics, Dynamics, Actuators & Physics Simulation",
      "slug": "robotics-humanoid-kinematics-dynamics-actuators-physics-simulation",
      "description": "Rigid-body kinematics and dynamics algorithms, humanoid bipedal locomotion, zero-moment point (ZMP) balance, robotic actuator control, spatial trajectory optimization, and GPU-accelerated physics simulation.",
      "parent_cluster": "Robotics, Physical Systems & Autonomous Vehicles",
      "keywords": [
        "robotics",
        "humanoid",
        "kinematics",
        "dynamics",
        "mujoco",
        "pinocchio",
        "physics-simulation",
        "actuators",
        "bipedal-locomotion"
      ],
      "top_languages": [
        "C++",
        "Python",
        "Other",
        "Rust",
        "JavaScript"
      ],
      "metrics": {
        "repository_count": 39,
        "total_stars": 318945,
        "total_forks": 52117,
        "language_diversity": 8
      }
    },
    {
      "id": 7,
      "stable_id": "cat-07-autonomous-vehicles-slam",
      "name": "Autonomous Vehicles, Mobile Robotics, LiDAR SLAM & Drone Flight Control",
      "slug": "autonomous-vehicles-mobile-robotics-lidar-slam-drone-flight-control",
      "description": "Autonomous driving software stacks, mobile robotic navigation, simultaneous localization and mapping (SLAM) using LiDAR and visual-inertial odometry, and UAV/drone autopilot systems.",
      "parent_cluster": "Robotics, Physical Systems & Autonomous Vehicles",
      "keywords": [
        "autonomous-vehicles",
        "slam",
        "lidar",
        "autoware",
        "point-cloud",
        "drone-control",
        "autopilot",
        "ros2",
        "odometry"
      ],
      "top_languages": [
        "C++",
        "TypeScript",
        "Shell",
        "Python",
        "Java"
      ],
      "metrics": {
        "repository_count": 25,
        "total_stars": 377437,
        "total_forks": 108649,
        "language_diversity": 8
      }
    },
    {
      "id": 8,
      "stable_id": "cat-08-semiconductor-eda-riscv",
      "name": "Semiconductor, Silicon EDA, RTL-to-GDSII, FPGA & RISC-V Architecture",
      "slug": "semiconductor-silicon-eda-rtl-to-gdsii-fpga-risc-v-architecture",
      "description": "Electronic Design Automation (EDA), register-transfer level (RTL) synthesis, physical placement and routing (P&R), formal hardware verification, FPGA bitstream toolchains, and open-source RISC-V processor architectures.",
      "parent_cluster": "Systems Programming, Cloud & Distributed Engines",
      "keywords": [
        "eda",
        "semiconductor",
        "riscv",
        "verilog",
        "openlane",
        "yosys",
        "fpga",
        "asic",
        "hardware-design"
      ],
      "top_languages": [
        "Python",
        "C",
        "Verilog",
        "C++",
        "SystemVerilog"
      ],
      "metrics": {
        "repository_count": 34,
        "total_stars": 225293,
        "total_forks": 33585,
        "language_diversity": 12
      }
    },
    {
      "id": 9,
      "stable_id": "cat-09-quantum-computing-algorithms",
      "name": "Quantum Computing, Quantum Algorithms, Circuit Simulation & Error Correction",
      "slug": "quantum-computing-quantum-algorithms-circuit-simulation-error-correction",
      "description": "Quantum circuit synthesis, unitary statevector and density matrix simulation, quantum variational algorithms (VQE, QAOA), quantum error correction (QEC surface codes), and quantum programming frameworks.",
      "parent_cluster": "Frontier Physics, Quantum & Clean Energy",
      "keywords": [
        "quantum-computing",
        "qiskit",
        "cirq",
        "pennylane",
        "quantum-algorithms",
        "qec",
        "circuit-simulation",
        "vqe",
        "qubit"
      ],
      "top_languages": [
        "Python",
        "Jupyter Notebook"
      ],
      "metrics": {
        "repository_count": 9,
        "total_stars": 21525,
        "total_forks": 7149,
        "language_diversity": 2
      }
    },
    {